{
  "schemaVersion": 1,
  "lastInventoryUpdate": "2026-07-04",
  "reviewPolicy": "Every user-facing medical, urgent-help, service-route or privacy claim must be checked here before public campaign launch. Source verification is not the same as medical review.",
  "claims": [
    {
      "id": "emergency-112-194",
      "pageOrComponent": "Urgent help module: index.html, play.html, prep-pep.html, after-sex.html, testing-sti.html, services.html",
      "claimHr": "Ako postoji neposredna opasnost, ozljeda, prisila ili hitna medicinska situacija, nazovi 112 ili 194.",
      "claimEn": "If there is immediate danger, injury, coercion, or an urgent medical situation, call 112 or 194 in Croatia.",
      "category": "emergency",
      "sourceUrl": "https://gov.hr/hr/hitne-sluzbe/338",
      "sourceName": "gov.hr - Hitne službe",
      "dateLastVerified": "2026-07-04",
      "nextReviewDate": "2026-10-04",
      "owner": "not-appointed",
      "medicalReviewStatus": "needs-review",
      "notes": "Official source lists 112 as the unified emergency number and 194 for emergency medical service.",
      "verificationStatus": "needs-verification",
      "source": "https://gov.hr/hr/hitne-sluzbe/338",
      "verifiedAt": null,
      "expiresAt": null
    },
    {
      "id": "pep-urgent-professional-assessment",
      "pageOrComponent": "prep-pep.html, after-sex.html, play.html, assets/js/story.js",
      "claimHr": "Ako misliš da ti možda treba PEP, potraži medicinsku pomoć što prije. PEP je vremenski osjetljiv i liječnik procjenjuje je li indiciran.",
      "claimEn": "If you think you may need PEP, seek medical help as soon as possible. PEP is time-sensitive and a doctor assesses whether it is indicated.",
      "category": "PEP",
      "sourceUrl": "https://bfm.hr/referentni-centar-za-dijagnostiku-i-lijecenje-zaraze-hiv-om/",
      "sourceName": "Klinika za infektivne bolesti \"Dr. Fran Mihaljević\" - PEP information",
      "dateLastVerified": "2026-07-04",
      "nextReviewDate": "2026-10-04",
      "owner": "not-appointed",
      "medicalReviewStatus": "needs-review",
      "notes": "Croatian source states to seek medical help immediately after possible exposure and that a doctor assesses risk and PEP introduction.",
      "verificationStatus": "needs-verification",
      "source": "https://bfm.hr/referentni-centar-za-dijagnostiku-i-lijecenje-zaraze-hiv-om/",
      "verifiedAt": null,
      "expiresAt": null
    },
    {
      "id": "pep-72-hour-window",
      "pageOrComponent": "prep-pep.html, after-sex.html, assets/js/story.js",
      "claimHr": "PEP je vremenski osjetljiv: potražite stručnu pomoć što prije, idealno unutar 24 sata, a najkasnije unutar 72 sata nakon mogućeg izlaganja.",
      "claimEn": "PEP is time-sensitive: seek professional help as soon as possible, ideally within 24 hours and no later than 72 hours after possible exposure.",
      "category": "PEP",
      "sourceUrl": "https://www.who.int/publications/i/item/9789240095137",
      "sourceName": "WHO - Guidelines for HIV post-exposure prophylaxis",
      "dateLastVerified": "2026-07-04",
      "nextReviewDate": "2026-10-04",
      "owner": "not-appointed",
      "medicalReviewStatus": "needs-review",
      "notes": "WHO overview describes timely access as crucial and states ideally within 24 hours and no later than 72 hours.",
      "verificationStatus": "needs-verification",
      "source": "https://www.who.int/publications/i/item/9789240095137",
      "verifiedAt": null,
      "expiresAt": null
    },
    {
      "id": "pep-not-self-service",
      "pageOrComponent": "prep-pep.html, play.html, assets/js/story.js",
      "claimHr": "PEP nije proizvod koji se samostalno uzima u ljekarni.",
      "claimEn": "PEP is not a pharmacy self-service product.",
      "category": "PEP",
      "sourceUrl": "https://bfm.hr/referentni-centar-za-dijagnostiku-i-lijecenje-zaraze-hiv-om/",
      "sourceName": "Klinika za infektivne bolesti \"Dr. Fran Mihaljević\" - PEP information",
      "dateLastVerified": "2026-07-04",
      "nextReviewDate": "2026-10-04",
      "owner": "not-appointed",
      "medicalReviewStatus": "needs-review",
      "notes": "The site uses this as a safety framing to avoid implying casual purchase or independent use. Confirm exact Croatian phrasing with medical reviewer.",
      "verificationStatus": "needs-verification",
      "source": "https://bfm.hr/referentni-centar-za-dijagnostiku-i-lijecenje-zaraze-hiv-om/",
      "verifiedAt": null,
      "expiresAt": null
    },
    {
      "id": "pep-reduces-not-guaranteed",
      "pageOrComponent": "prep-pep.html, after-sex.html, assets/js/story.js",
      "claimHr": "PEP može smanjiti mogućnost infekcije HIV-om ako se započne na vrijeme nakon stručne procjene i uzima prema uputama. Nije jamstvo.",
      "claimEn": "PEP can reduce the chance of HIV infection when started in time after professional assessment and taken as prescribed. It is not guaranteed.",
      "category": "PEP",
      "sourceUrl": "https://www.cdc.gov/hivnexus/hcp/pep/index.html",
      "sourceName": "CDC - Clinical Guidance for PEP",
      "dateLastVerified": "2026-07-04",
      "nextReviewDate": "2026-10-04",
      "owner": "not-appointed",
      "medicalReviewStatus": "needs-review",
      "notes": "Prototype wording avoids guarantees. Medical reviewer should confirm final public wording.",
      "verificationStatus": "needs-verification",
      "source": "https://www.cdc.gov/hivnexus/hcp/pep/index.html",
      "verifiedAt": null,
      "expiresAt": null
    },
    {
      "id": "prep-baseline-assessment",
      "pageOrComponent": "prep-pep.html, assets/js/story.js",
      "claimHr": "PrEP je planirana prevencija HIV-a prije mogućeg izlaganja. Zahtijeva testiranje na HIV, liječničku procjenu, recept i praćenje. PrEP štiti od HIV-a, ne od drugih spolno prenosivih infekcija.",
      "claimEn": "PrEP is planned HIV prevention before possible exposure. It requires HIV testing, medical assessment, prescription, and follow-up. PrEP protects against HIV, not against other STIs.",
      "category": "PrEP",
      "sourceUrl": "https://www.cdc.gov/hivnexus/hcp/prep/index.html",
      "sourceName": "CDC - Clinical Guidance for PrEP",
      "dateLastVerified": "2026-07-04",
      "nextReviewDate": "2026-10-04",
      "owner": "not-appointed",
      "medicalReviewStatus": "needs-review",
      "notes": "CDC states PrEP is HIV prevention for people without HIV and baseline assessment/HIV testing is required before prescribing.",
      "verificationStatus": "needs-verification",
      "source": "https://www.cdc.gov/hivnexus/hcp/prep/index.html",
      "verifiedAt": null,
      "expiresAt": null
    },
    {
      "id": "testing-directory-anonymous-free",
      "pageOrComponent": "testing-sti.html, services.html, sources.html",
      "claimHr": "U centrima za HIV savjetovanje i testiranje u Hrvatskoj može se anonimno i besplatno testirati na HIV i dobiti individualan savjet stručnjaka.",
      "claimEn": "Croatian HIV counseling and testing centers can provide anonymous and free HIV testing and individual professional counseling.",
      "category": "HIV testing",
      "sourceUrl": "https://www.hzjz.hr/news-2/gdje-se-u-hrvatskoj-moze-savjetovati-i-testirati-na-hiv/",
      "sourceName": "HZJZ - Gdje se u Hrvatskoj može savjetovati i testirati",
      "dateLastVerified": "2026-07-04",
      "nextReviewDate": "2026-10-04",
      "owner": "not-appointed",
      "medicalReviewStatus": "needs-review",
      "notes": "Individual services still need direct verification before public launch.",
      "verificationStatus": "needs-verification",
      "source": "https://www.hzjz.hr/news-2/gdje-se-u-hrvatskoj-moze-savjetovati-i-testirati-na-hiv/",
      "verifiedAt": null,
      "expiresAt": null
    },
    {
      "id": "testing-window-period-general",
      "pageOrComponent": "testing-sti.html, index.html",
      "claimHr": "Period prozora i potreba za ponavljanjem ovise o testu i situaciji; savjetovalište ili zdravstveni djelatnik trebaju pomoći s odabirom vremena testiranja.",
      "claimEn": "Window periods and repeat testing depend on the test and situation; a counseling service or healthcare provider should help choose timing.",
      "category": "HIV testing",
      "sourceUrl": "https://www.hzjz.hr/news-2/gdje-se-u-hrvatskoj-moze-savjetovati-i-testirati-na-hiv/",
      "sourceName": "HZJZ - Counseling and testing directory",
      "dateLastVerified": "2026-07-04",
      "nextReviewDate": "2026-10-04",
      "owner": "not-appointed",
      "medicalReviewStatus": "needs-review",
      "notes": "General safe framing only; no test-specific timing is given in the prototype.",
      "verificationStatus": "needs-verification",
      "source": "https://www.hzjz.hr/news-2/gdje-se-u-hrvatskoj-moze-savjetovati-i-testirati-na-hiv/",
      "verifiedAt": null,
      "expiresAt": null
    },
    {
      "id": "service-bfm-testing-and-pep",
      "pageOrComponent": "services.html, prep-pep.html, after-sex.html, sources.html",
      "claimHr": "Klinika za infektivne bolesti \"Dr. Fran Mihaljević\" objavljuje informacije o savjetovanju/testiranju na HIV, hepatitise i sifilis te o PEP-u.",
      "claimEn": "The \"Dr. Fran Mihaljević\" infectious diseases clinic publishes information about HIV/hepatitis/syphilis counseling/testing and PEP.",
      "category": "service route",
      "sourceUrl": "https://bfm.hr/referentni-centar-za-dijagnostiku-i-lijecenje-zaraze-hiv-om/",
      "sourceName": "Klinika za infektivne bolesti \"Dr. Fran Mihaljević\"",
      "dateLastVerified": "2026-07-04",
      "nextReviewDate": "2026-10-04",
      "owner": "not-appointed",
      "medicalReviewStatus": "needs-review",
      "notes": "Operational details can change; service entry is shown as needs-verification before visit.",
      "verificationStatus": "needs-verification",
      "source": "https://bfm.hr/referentni-centar-za-dijagnostiku-i-lijecenje-zaraze-hiv-om/",